{
  "schema_version": 1,
  "level_id": "L18",
  "verification": "not_run",
  "steps": [
    {
      "op": "command",
      "type": "PlaceProp",
      "payload": {
        "entity_id": "thermal_screen",
        "slot_id": "thermal_block"
      }
    },
    {
      "op": "command",
      "type": "PlaceProp",
      "payload": {
        "entity_id": "heated_stone",
        "slot_id": "warm_boat"
      }
    },
    {
      "op": "command",
      "type": "RunResolution",
      "payload": {}
    },
    {
      "op": "advance_ticks",
      "count": 60
    },
    {
      "op": "command",
      "type": "StopResolution",
      "payload": {}
    },
    {
      "op": "command",
      "type": "AssignRoute",
      "payload": {
        "actor_id": "boat",
        "route_id": "boat_route"
      }
    },
    {
      "op": "command",
      "type": "RunResolution",
      "payload": {}
    },
    {
      "op": "advance_ticks",
      "count": 150
    },
    {
      "op": "assert",
      "predicate": "level_success"
    }
  ],
  "expected_final_predicates": [
    "level_success"
  ]
}
