{
  "schema_version": 1,
  "level_id": "L12",
  "verification": "not_run",
  "steps": [
    {
      "op": "command",
      "type": "PlaceProp",
      "payload": {
        "entity_id": "bread",
        "slot_id": "bread_box"
      }
    },
    {
      "op": "command",
      "type": "Interact",
      "payload": {
        "entity_id": "box",
        "action": "close"
      }
    },
    {
      "op": "command",
      "type": "RunResolution",
      "payload": {}
    },
    {
      "op": "advance_ticks",
      "count": 60
    },
    {
      "op": "command",
      "type": "StopResolution",
      "payload": {}
    },
    {
      "op": "command",
      "type": "PlaceProp",
      "payload": {
        "entity_id": "bread",
        "slot_id": "bread_delivery"
      }
    },
    {
      "op": "command",
      "type": "PlaceProp",
      "payload": {
        "entity_id": "dessert",
        "slot_id": "dessert_delivery"
      }
    },
    {
      "op": "command",
      "type": "PlaceProp",
      "payload": {
        "entity_id": "box",
        "slot_id": "box_delivery"
      }
    },
    {
      "op": "command",
      "type": "AssignRoute",
      "payload": {
        "actor_id": "delivery",
        "route_id": "cross"
      }
    },
    {
      "op": "command",
      "type": "RunResolution",
      "payload": {}
    },
    {
      "op": "advance_ticks",
      "count": 150
    },
    {
      "op": "assert",
      "predicate": "level_success"
    }
  ],
  "expected_final_predicates": [
    "level_success"
  ]
}
